titre,texte,source_site,url,date_publication,langue,hash_fingerprint
Données d'activité en lien avec le cancer dans les établissements de santé en France,"Tous les ans, **l’Institut National du Cancer (INCa)** fournit les données agrégées décrivant l’activité de cancérologie des établissements de santé en France. Ces données sont élaborées à partir des informations issues du **Programme de médicalisation des systèmes d'information (PMSI)** diffusées par **l’Agence technique de l’information sur l’hospitalisation (ATIH)**. Elles couvrent les 3 secteurs que sont :

* la Médecine, chirurgie, obstétrique (MCO)

* les Soins médicaux de réadaptation (SMR), ex Soins de suite ou de réadaptation (SSR)

* et, l'Hospitalisation à domicile (HAD)

En MCO et en SMR (ex-SSR), les séjours liés au cancer sont identifiés par **les algorithmes de sélection des hospitalisations liées à la prise en charge du cancer pour ces 2 champs développé conjointement avec l’Institut National du Cancer (INCa)** et des représentants des fédérations hospitalières publiques et privées.

Les données permettent de visualiser l’activité hospitalière liée aux soins des patient",data.gouv.fr,https://www.data.gouv.fr/datasets/donnees-dactivite-en-lien-avec-le-cancer-dans-les-etablissements-de-sante-en-france/,2025-10-17 12:37:38.030000+00:00,fr,9ec1cfcb1cab7e17d63ac70b70b9c0b145419e75ea6cd91ec2a0d7df28657a62
