titre,texte,source_site,url,date_publication,langue,hash_fingerprint
Se débarrasser de cartons déménagement,"Bonjour,

Suite à un déménagement, je me retrouve avec beaucoup de gros cartons. La poubelle jaune de mon immeuble est toujours pleine et la poubelle de tri extérieure est assez loin. J'ai regardé en ligne pour la gestion des encombrants par la mairie mais ils ne prennent pas de cartons, d'après ce qui est marqué sur leur site. J'ai aussi regardé une association, cartons pleins, mais celle ci a un trop plein de stock et ne pourra pas les collecter. Auriez vous d'autres solutions ? Connaissez vous un moyen pour se débarrasser de ces cartons ? 
Merci par avance!",reddit.com,https://reddit.com/r/paris/comments/1ohjk6n/se_débarrasser_de_cartons_déménagement/,2025-10-27 17:45:29,fr,4ceb095c52d2400ea8f74b1439028aa38636ff03c10df152cbeb71c1698bc2fa
Go out Monday evening,"Hello everyone! 

I wanted to know if there is a specific bar where there are good evenings on Mondays? It's my going away party and we want to do something. 

Maybe a cool event? If there are singles it's better jajajajaj",reddit.com,https://reddit.com/r/paris/comments/1ohj3pp/go_out_monday_evening/,2025-10-27 17:28:34,fr,9298c1871db5f5c2a406547d216c3bdc833ac366c756746b12c6db22182bcf07
sites/groupes pour trouver des sous-loc ?,"Salut ! j’habite deja à paris mais j’aimerais bien me trouver un petit appart peut être en coloc à paris ou alentours, sauf que j’ai un budget serré donc si vous connaissez des groupes qui partagent des offres type sous location, chambre chez l’habitant etc (type groupe whats app, facebook..) afin de trouver peut être des logements à moindre coût voir même pour des durées courtes 
merci !  ",reddit.com,https://reddit.com/r/paris/comments/1ohmin1/sitesgroupes_pour_trouver_des_sousloc/,2025-10-27 19:34:28,fr,d146ae19b73eeb904a20fe2706627017f31666626a946ec52a2fdffceed94d62
"Recherche un sauna ""classique""","Bonjour, je cherche un endroit sur Paris ou proche banlieue où faire du sauna, qui ne soit ni un sauna libertin, ni dans un hôtel de luxe. Je ne souhaite pas non plus faire de soin. Juste profiter d'une séance de sauna ""simple"". Si cela fait partie d'une salle de sport ou d'une piscine, pourquoi pas, tant que c'est un vrai sauna en bois. Merci pour vos recommandations !

ÉDIT : pas de sauna gay, naturiste ou libertin, ce qui revient au même sur Paris (je n'aurais aucun problème à aller en lieu naturiste ou même gay si ce n'étaient pas des lieux de drague où venir en visiteur lambda était sincèrement possible).",reddit.com,https://reddit.com/r/paris/comments/1ogphp9/recherche_un_sauna_classique/,2025-10-26 17:49:14,fr,a3a6162e211f782f127f9a9e880c9059698ac851bcce1dca8ba93b7dbfeb925a
Vivre à Saint Denis (métro Porte de Paris) en tant que jeune femme ?,"Salut la commu !

Je suis une jeune femme de 29 ans, et j'ai visité un appartement à Saint Denis, proche du métro Porte de Paris. Il a l'air vraiment bien : spacieux, lumineux, bref il coche pas mal de critères !

Ne connaissant pas le quartier, je suis preneuse de retour d'expériences de jeunes femmes qui habitent dans ce coin ? Surtout, est-ce que vous vous sentez safe pour rentrer le soir/nuit notamment ?

Sachant que je sors pas mal, et ça peut m'arriver de rentrer en métro bourrée. **😇**

Aussi, je redoute un peu les soirs de matchs/évènements au Stade de France...

Bref, n'hésitez pas à témoigner (please pas de commentaires de personnes qui n'y ont jamais mis les pieds et ont des préjugés sur le lieu) :)",reddit.com,https://reddit.com/r/paris/comments/1ogtfuw/vivre_à_saint_denis_métro_porte_de_paris_en_tant/,2025-10-26 20:24:08,fr,cf76ef828f654a606ed31a209117c956a140e853dbfaf79c0e107122deca4378
Study/work places,"Hi, I am looking for nice places (coffee shops/libraries/anything else) to go to study/work on my laptop. 
What are your favorite places ? Looking for something with decently comfortable chairs/tables, not sitting high up at a bar as in some coffee shops. 

Thanks ! 🙏 ",reddit.com,https://reddit.com/r/paris/comments/1ohal57/studywork_places/,2025-10-27 11:14:50,fr,2bd43ecb562dadf9303162d8beedb1e1e1f123c4afe6e562e92346371d36e724
Marché with prices similar to marché barbes,"Hi, are there any other marchés in and around Paris with prices similar to Marché Barbes?",reddit.com,https://reddit.com/r/paris/comments/1oh9oqw/marché_with_prices_similar_to_marché_barbes/,2025-10-27 10:16:52,fr,ecf462aba8ace6d7c27f27a09076be757ecc6954b7c4c78f66521c630e6ac9b5
Visiting researcher living in Paris,"Hello, my university will send me to paris for a year, I have 900 euros to rent. I would like recommendations for safe neighborhoods, especially for women. The university is in Saint Denis. What do you recommend?

edit; Thank you for the suggestions, my biggest concern is my partner, I thought about living in 20 in Belleville or 13. What do you think?",reddit.com,https://reddit.com/r/paris/comments/1oh42it/visiting_researcher_living_in_paris/,2025-10-27 04:20:56,fr,45fb791f9c21a139b8baccf640c3e795384a090089c80ec7ef384811d26a9c30
[English-speaking parents/parents-to-be] How was your experience in Paris?,"Being pregnant and non-French, navigating admin and medical processes, how did it go? What was great and not so great?  
Personally, I found the admin process a mess (having to collect info from multiple sources, not always in English ..), but some people seem to think it's fine.  
Curious to know other people's experiences, especially if you don't speak any/much French.",reddit.com,https://reddit.com/r/paris/comments/1oh9ikt/englishspeaking_parentsparentstobe_how_was_your/,2025-10-27 10:05:23,fr,3ae850595698e57c5ad2dd9a65b0a255caf28fc354944fe451983a3f68ab5ca1
Questions sur les refus de logement social,"Salut à tous,
Avec ma femme, on fait notre première demande de logement social en Île-de-France.
On vit à Montreuil, on bosse à Paris (8e et 11e), on a un petit garçon de 3 ans et un deuxième bébé en route. On cherche un F4.

J’ai plusieurs zones d’ombre et j’aimerais vos retours d’expérience concrets 👇

1. Les villes à cocher :
Mieux vaut cibler 2-3 communes précises (genre Montreuil, Paris 11e, Vincennes) ou élargir à fond (10-15 communes) pour augmenter les chances ?
Est-ce que trop élargir peut jouer contre nous (genre recevoir une proposition qu’on ne veut pas vraiment et risquer de la refuser) ?


2. Les refus :
Si on nous propose un logement dans une des communes qu’on a choisies et qu’on refuse, c’est grave ?
Genre, ça “plombe” le dossier, ou on a droit à 1-2 refus avant d’être mal vus ?


3. Les bailleurs :
J’ai lu qu’il fallait aller voir directement les bailleurs sociaux (en plus de la demande en ligne) pour “se faire connaître”.
C’est vrai ?
Si oui, ça marche comment ? On c",reddit.com,https://reddit.com/r/paris/comments/1oh9ije/questions_sur_les_refus_de_logement_social/,2025-10-27 10:05:19,fr,f932f45bb64eca63ee49817222145a6f18de56f5dc19af0aac4b14e843144ea8
Est-ce qu'il y a des stores ou je peux toucher des mousepads pour vraiment voir si je l'aime?,"Bonjour,   
J'ai utilise' mon Logitech mousepad depuis presque 15 ans, donc c'est temps a' acheter a nouveau. Je cherche quelque chose un peu 'elegant', et surtout comfortable. Mais si je commande quelque chose enligne, j'ai peur que ce sera un surprise, et je dois passer beaucoup de temps a re-envoyer, re-demander an eutre, etc. etc. 

Donc si vous connaissez un magasin ou c'est possible a 'essayer' les mousepads, je suis tres curioux. 

Merci!",reddit.com,https://reddit.com/r/paris/comments/1oh964z/estce_quil_y_a_des_stores_ou_je_peux_toucher_des/,2025-10-27 09:41:45,fr,54023edca99819b8f8477b6f1ed67e22c02ed7bcb039dd931b03818c93ef78d0
How to protect my deposit from landlord?,"Hi,

I moved into an apartment 6 months ago, I am moving out soon. There are two problems with the apartment, one is the electric heater stops working if there is even a small spil of water and I need to wait a week for the eater to dry from the crevices to operate it again, I informed my landlord and he only told me it's my fault and told me to airdry it to make it work. Second, there is a Dyson vacuum cleaver which is not working, I know the proble with this, the battery pack has gone bad as it's an old machine, it was charge partially before enow it doesn't charge. Now my land lord is asking me to repair or replace it before i leave at end of month otherwise I think he might be vindictive and hold every thing accountable. I have picture of  why the electric cooking heater fails and also for the vaccum cleaner.

Do you think he will create problems in giving back my deposit. He also mentioned to use my insurance to get the replacement reimbursement.

What should I do in this scenario",reddit.com,https://reddit.com/r/paris/comments/1ogq83r/how_to_protect_my_deposit_from_landlord/,2025-10-26 18:18:39,fr,67bc67b23698356baa2976a9be9d5e04a1e0a3544467df1dc035b9faa24423ab
What is your secret place to recharge your batteries?,"For my part, there is a magical square in Paris, a very small square where you have the impression that time has stopped: Place du Calvaire, it is located in Montmartre.",reddit.com,https://reddit.com/r/paris/comments/1ogdz3v/what_is_your_secret_place_to_recharge_your/,2025-10-26 07:58:05,fr,cd1ead7a07d72354773c731559147faba59c31855d253b0fbd0d87839a5e82be
Why did the Eiffel Tower sparkle 3 times from 8 to 9pm on Sept 29th,"So, I went to the tower on the evening of September 29th, 2025, at 8 pm, and I only thought it would sparkle at 8 and 9. My wife and I were on the lawn at Champ de Mars, having a picnic, waiting for 9. But it started sparkling at 8:30 for some reason. Nobody expected it, so we thought it was a mistake or something. Then it sparkled again at 8:45, and then 9. I got back home yesterday and looked everywhere for why it was doing that, but I couldn't find anything. Anyone know why?",reddit.com,https://reddit.com/r/paris/comments/1ogogl0/why_did_the_eiffel_tower_sparkle_3_times_from_8/,2025-10-26 17:07:58,fr,012d5d63afcffa22baf0b2e37a265c9c641f8af3aa085953604d5ce84f671900
"S’installer à paris sans expérience, besoin de conseils (un peu désespérée😅)","Salut tout le monde,

je poste ici un peu désespérée, parce que je vis dans un coin paumé qui me ruine la santé mentale. J’ai besoin de changer d’air, de vivre dans un endroit plus vivant, plus multiculturel, où je pourrais rencontrer des gens et me sentir moins seule.

Peut-être que ce post ne servira pas à grand chose, mais je tente: 

J’ai 20 ans, je suis une femme, sans vraie expérience pro à part quelques stages et services civiques. J’aimerais vraiment venir m’installer à Paris, ou dans le coin, mais je sais que c’est pas simple sans job garanti, ni garant

J’entends souvent dire que certaines personnes s’y sont installées un peu sur un coup de tête, qu’elles ont galéré au début mais qu’elles ont fini par s’en sortir avec de la débrouille et des rencontres. J’aimerais que ce soit possible pour moi aussi, peut-être que je suis un peu naïve, mais j’ai besoin d’y croire. Je m'en voudrais de pas avoir essayé de me renseigner et d'en apprendre plus en discutant avec des gens  

Je che",reddit.com,https://reddit.com/r/paris/comments/1oh1npb/sinstaller_à_paris_sans_expérience_besoin_de/,2025-10-27 02:20:57,fr,14c66c6ce792d2686a6f18fa9319caeb7612a96b8889e6cf19e4ba46442ec4b8
À quoi servent ces boutons ?,"
Je les ai trouvés à un arrêt de bus.",reddit.com,https://reddit.com/r/paris/comments/1ofqm1m/à_quoi_servent_ces_boutons/,2025-10-25 14:44:43,fr,88d9d0716522a628ca1d88c128b3f01a0bad675be0d1f31775e10a2c575ebe26
cherche un bon orthodentiste,"Bonjour je cherche un bon orthodentiste à me recommender sur Paris/Ile de France . 

Pas trop cher svp c'est pour pauser des bagues pour adulte   
Merci!!!  
",reddit.com,https://reddit.com/r/paris/comments/1ogqq8l/cherche_un_bon_orthodentiste/,2025-10-26 18:38:13,fr,cd8dbc1958d715f2924b0ebabcdd67e13e0cad3f08dadec98d512ec49827fe09
Jihadists enforce a blockade on fuel in Mali • FRANCE 24 English,The U.S. Embassy in Mali told American citizens Tuesday to leave the country by plane because of the threats of terrorism and a ...,youtube.com,https://www.youtube.com/watch?v=XRcfyuv26rw,2025-10-28 20:34:12+00:00,fr,2823b25af9e5ad928b03732974840a2bf431bc0dc36270c4e006e99e8ecf8f68
Musk launches Grokipedia to rival &#39;left-biased&#39; Wikipedia • FRANCE 24 English,"Elon Musk's company xAI has launched a website called Grokipedia to compete with online encyclopedia Wikipedia, which he ...",youtube.com,https://www.youtube.com/watch?v=u9MO2muCj4I,2025-10-28 19:33:57+00:00,fr,b7fb61d5b5febe192bb1acc050c0405a0190423da5673afe787b94ef3a245671
"US launches strikes on alleged drug-running boats off Colombia, killing 14 • FRANCE 24 English",Defense Secretary Pete Hegseth announced Tuesday that the U.S. military has carried out three strikes in the eastern Pacific ...,youtube.com,https://www.youtube.com/watch?v=krQwniaIL6o,2025-10-28 19:28:43+00:00,fr,a8bb10334f7fb512f17a3d086c9ebd937b9daf891a83c950f7a1b8002537e1ef
Israeli planes strike Gaza City after Netanyahu orders &#39;powerful attacks&#39; • FRANCE 24 English,Israeli planes launched strikes on Gaza City on Tuesday after Prime Minister Benjamin Netanyahu accused the militant group ...,youtube.com,https://www.youtube.com/watch?v=uJctCSeiyKI,2025-10-28 19:20:05+00:00,fr,511378245a766998dd717ed45fb919cb868104ae0053e7eee6addcfd7d8a05e7
"Texas sues Tylenol makers, claiming they hid drug&#39;s autism risks • FRANCE 24 English","The makers of Tylenol, Johnson & Johnson and Kenvue, were sued on Tuesday by Texas Attorney General Ken Paxton, who ...",youtube.com,https://www.youtube.com/watch?v=698DqOjVffE,2025-10-28 15:40:13+00:00,fr,da875c9458bc7e92af152e78a69a21c0a6f009062cdb114c4063c911136a53b4
Health: mRNA Covid vaccines may help fight cancer • FRANCE 24 English,"Preliminary research published in Nature suggests that COVID-19 vaccines, particularly Pfizer and Moderna, may offer ...",youtube.com,https://www.youtube.com/watch?v=KTr8HA79Zck,2025-10-28 15:41:33+00:00,fr,cf731e44e9f85a979136b074f3237d581aed4928e41d97b3a2c7a4138a87b700
Jamaica: Up to 1.5 million people could be affected by category 5 Hurricane Melissa • FRANCE 24,"Hurricane Melissa is approaching Jamaica, with authorities on high alert as the island braces for impact. While the country is no ...",youtube.com,https://www.youtube.com/watch?v=GtS0g0hVaPQ,2025-10-28 15:37:26+00:00,fr,152f483c24f227b2e18394efaf820ee291d4ce1b98240519007ef99a00038741
UN accuses Sudanese forces of crimes against humanity amid Darfur crisis • FRANCE 24 English,The UN Human Rights Council reports that both the Sudanese Armed Forces and the Rapid Support Forces (RSF) are ...,youtube.com,https://www.youtube.com/watch?v=3NeIAsH1vNQ,2025-10-28 15:20:46+00:00,fr,baa8d4421e9314994d229e6b4ce5f5dcae90af235eb84964ea7cb9abddaea7ea
France&#39;s Brigitte Macron harassment trial : &#39;Since when has it been a crime to make a joke?&#39;,"On the second day of their trial in Paris, ten defendants face charges for harassment ,claiming that Brigitte Macron was born a man ...",youtube.com,https://www.youtube.com/watch?v=NicZYyds9TI,2025-10-28 15:18:40+00:00,fr,6ff5e117eed2fc5dd993139aaf0b42e298ac3266b969718dae6bb73152982014
New York mayoral race enters final stretch • FRANCE 24 English,Polling places opened on Saturday for in-person voting in two of the year's most closely watched elections: the New York City ...,youtube.com,https://www.youtube.com/watch?v=uhd_oISSsyw,2025-10-28 14:58:25+00:00,fr,952ec3dc9e7347d1d332877929e977ee61d4ec5f1b7b9239bbabc3db62dc9ea5
Former Vietnamese imperial city of Hue flooded after record rainfall • FRANCE 24 English,The former imperial city of Hue found itself flooded after record rainfall in #Vietnam. Nearly two metres of water fell in just 24 hours ...,youtube.com,https://www.youtube.com/watch?v=jLsU9eL8vQQ,2025-10-28 14:47:55+00:00,fr,47015297752f4f96c7b14b0f75b2311fed710114aa13e3555e0f9283c35c21fc
US and Japan forge stronger alliances • FRANCE 24 English,"US President Donald Trump is on a visit to Japan, where he met with newly elected Prime Minister Sanae Takaichi, highlighting ...",youtube.com,https://www.youtube.com/watch?v=EsCeJ9qfh2g,2025-10-28 14:33:11+00:00,fr,54b30183377a9419d5b021a79b976edd64bb06206b62b697e205b358863ade61
UN warns of climate crisis as most countries fail to update carbon plans • FRANCE 24 English,"A recent UN report reveals that most countries have failed to update their carbon-cutting plans as part of the Paris Agreement, and ...",youtube.com,https://www.youtube.com/watch?v=DFtSJJ4_-pg,2025-10-28 14:30:47+00:00,fr,af4ba397f3ccac6be6326086ab09d4ad9a60b81d03df617c8e500a8f12eb5ac7
US food assistance faces funding shortfall amid shutdown • FRANCE 24 English,"Food banks and pantries, already struggling after cuts to federal programs, are bracing for a surge in demand as a federal food ...",youtube.com,https://www.youtube.com/watch?v=uq98oZsvk-0,2025-10-28 14:26:47+00:00,fr,966d4e28fd8a529380419ab1e91e0e5263fb52358d5bd107502eedcd7d6f0a72
Venezuela suspends gas deal as Trinidad hosts US warship • FRANCE 24 English,"Venezuela on Monday suspended energy agreements with Trinidad and Tobago, over what officials have described as 'hostile' ...",youtube.com,https://www.youtube.com/watch?v=w2AgU0tdPU8,2025-10-28 14:23:26+00:00,fr,4e6a6e664662ac4d032bb43f8768a7c5c0a803b214b9ed9dcc03a258db7911f7
"&#39;Every day the situation for Afghan women gets worse and worse,&#39; campaigner says • FRANCE 24",A leading campaigner for women's and girls' rights in Afghanistan says the recent cutting off of the internet in the country led many ...,youtube.com,https://www.youtube.com/watch?v=viMfmpmpPqA,2025-10-28 14:04:41+00:00,fr,9ab82b85d5a2a0a846602d02acd5a36838bd14c5fb046b7d649fd7dabfddaf32
Precious Okoyomon&#39;s poetic language and unruly artwork • FRANCE 24 English,"Dreaming up creations that resemble a garden of earthly delights, filled with beauty, decay and poetry: Precious Okoyomon is a ...",youtube.com,https://www.youtube.com/watch?v=5OnF94Nj6EY,2025-10-28 13:22:13+00:00,fr,f169e1669a2c15da9b837ce424573695b8858190b8d25079faf6b56996453797
Japanese new PM rolls out &#39;charm offensive&#39; for Donald Trump • FRANCE 24 English,US President Donald Trump is currently in Japan for a key visit as the country faces growing concerns over China's rise and North ...,youtube.com,https://www.youtube.com/watch?v=NMqvZZPUr6c,2025-10-28 11:59:48+00:00,fr,f824e416507899a183ab988442ed4ead0b85ab4833dc3e3e9a421393ec7fd016
"Sudan: Army acknowledges defeat in El-Fasher, UN warns of violence • FRANCE 24 English","The fall of El-Fasher to the Rapid Support Forces (RSF) marks a turning point in the Sudanese conflict, with General Abdel Fattah ...",youtube.com,https://www.youtube.com/watch?v=YHGv4scXhOE,2025-10-28 11:56:50+00:00,fr,705a66d991e655560d22d56cb4b68969731815319f872b632742a084a6161f05
Cameroon: Violence erupts following Paul Biya&#39;s election victory • FRANCE 24 English,"Violent incidents broke out across Cameroon following the announcement of Paul Biya's victory with 55.66% of the vote, defeating ...",youtube.com,https://www.youtube.com/watch?v=4ALStDMst0U,2025-10-28 11:54:42+00:00,fr,17d779ec66d0563ffb8c1b93e9e07a42e1007cb3a5c8af7603e6621046f18393
"Ivory Coast: Ouattara re-elected with 89.77% of the vote, calm prevails after election • FRANCE 24","With 89.77% of the vote, President Alassane Ouattara has been re-elected for a fourth term, pending validation by the ...",youtube.com,https://www.youtube.com/watch?v=X-kI0jx9DpA,2025-10-28 11:53:15+00:00,fr,71bb6dff2a097f99294ff42d53d80bb73386ee1a4165adc0d0e186dda6a2ae68
Domestic workers jobs decline in South Africa • FRANCE 24 English,A recent poll reveals that around 400000 South African domestic workers have lost their jobs over the past five years. The primary ...,youtube.com,https://www.youtube.com/watch?v=5mZPfE4PGzg,2025-10-28 11:49:49+00:00,fr,62a919aa0e312e3abb06580e272c89a6be3d01f3ca7f2214a563dfafecf8ea4c
Mali closes schools due to fuel shortage • FRANCE 24 English,Malian authorities announced on Sunday the suspension of classes in schools and universities for two weeks nationwide due to a ...,youtube.com,https://www.youtube.com/watch?v=uldU3IAJnH8,2025-10-28 11:51:06+00:00,fr,95dfacd58fe2f1c5c42c3370333e62cb7f570f2fc40efe1c04a52a6f731c7f53
Excavations in Gaza underway to recover Israeli hostage bodies • FRANCE 24 English,Excavations are underway in #Gaza to recover the remaining bodies of #Israeli hostages. Egypt sent in heavy machinery and ...,youtube.com,https://www.youtube.com/watch?v=7Pxuus2b4sE,2025-10-28 11:35:29+00:00,fr,2bbbe27cf1e813f292957227bc18f401be2074ac176b164c6e41e7c5120c601a
Could US trade deals push ASEAN countries into the arms of China? • FRANCE 24 English,Several trade deals and frameworks between the US and Southeast Asian countries unveiled at the recent ASEAN summit heavily ...,youtube.com,https://www.youtube.com/watch?v=wmIvQgihldk,2025-10-28 11:18:12+00:00,fr,30cecc4b029722c031975f6de3765dabe9d8a5019f50e46a6e4873d6599f3db7
France&#39;s AI drones set to revolutionise military surveillance • FRANCE 24 English,"Near Paris, French manufacturer Thales is showcasing how a swarm of drones operates using AI, allowing for autonomous ...",youtube.com,https://www.youtube.com/watch?v=IF3fQCl43LI,2025-10-28 11:16:28+00:00,fr,740d7f02ddd32f8081c0a9819c09c93793bcf7e2ebb2e1dadff6ab3d5a91228e
RSF expands control in western Sudan • FRANCE 24 English,The paramilitary force fighting since 2023 to take over Sudan has ousted the army from its last stronghold in the western Darfur ...,youtube.com,https://www.youtube.com/watch?v=PfzDH9vOFXU,2025-10-28 11:14:18+00:00,fr,7a5908cf6c9e2f33fde1abed2e2fa0f38b2958d143cdad137dc88f585e49581e
"In the Netherlands, immigration dominates election campaign • FRANCE 24 English",Dutch voters head to the polls on October 29 and far-right parties have made immigration the central issue of the campaign.,youtube.com,https://www.youtube.com/watch?v=IdQEzTeCovM,2025-10-28 11:06:25+00:00,fr,e324c5632de9e7704b3f1b4ec4bf5f6b0547c17a9b019560ab1b050aa0054b5b
Russia&#39;s repeated attacks on civilians in Ukraine called crimes against humanity • FRANCE 24,The UN Commission has determined that Russia's repeated attacks on civilians in three Ukrainian regions amount to crimes ...,youtube.com,https://www.youtube.com/watch?v=G5xYTz5-EF0,2025-10-28 10:29:43+00:00,fr,a91bef4b8d0f6c8e3ddf81e6648eb350b3a6bf34c92b8b46e5f8673613fcd0ed
Gaza calls for international help as thousands remain missing under rubble • FRANCE 24 English,"In Gaza, the search for Israeli hostages' bodies intensifies as local civil defense workers call for international aid to retrieve and ...",youtube.com,https://www.youtube.com/watch?v=ubBS85UQUTc,2025-10-28 10:25:51+00:00,fr,b9e175b89b429a7b74b15a07b8d4f70494fd34283e53883030d2d2e75ef35803
Indice de durabilité - Lave-linge (organisation Vestel France) - TUCSON_TLL914T2A_ID,"Ce jeu de données répond aux spécifications du schéma ""Indice de durabilité - Lave-linge"" disponible sur le site [schema.data.gouv.fr](https://schema.data.gouv.fr/etalab/indice-durabilite-lave-linge)",data.gouv.fr,https://www.data.gouv.fr/datasets/indice-de-durabilite-lave-linge-organisation-vestel-france-tucson-tll914t2a-id/,2025-10-27 10:42:47.724000+00:00,fr,85a77f20f4d320f1b19ec3bb739b0c65d13976e361e503bf0d5a87f446113c12
Part des véhicules à faibles émissions dans le renouvellement d'un parc (organisation ZOETIS FRANCE),"Ce jeu de données répond aux spécifications du schéma ""Part des véhicules à faibles émissions dans le renouvellement d'un parc"" disponible sur le site [schema.data.gouv.fr](https://schema.data.gouv.fr/etalab/schema-vehicules-faibles-emissions-renouvellement-parc)",data.gouv.fr,https://www.data.gouv.fr/datasets/part-des-vehicules-a-faibles-emissions-dans-le-renouvellement-dun-parc-organisation-zoetis-france-4/,2025-10-22 12:52:05.992000+00:00,fr,32e9f7145fdbcc5e5a47bd93d6ef35a906b29f0fab938274f6693f9b568256dd
Catalogue des variétés d'oléoprotéagineux déclarées commercialisées en France,"Ce fichier comprend la liste des variétés déclarées commercialisées à Terres Inovia pour l'année par les semenciers.

Il concerne les cultures suivantes : colza, tournesol, pois, soja, féverole, lin, lupin, chanvre, pois chiche, lentille.

Dernière mise à jour : 2023
",data.gouv.fr,https://www.data.gouv.fr/datasets/catalogue-des-varietes-doleoproteagineux-declarees-commercialisees-en-france/,2025-10-21 14:03:45.708000+00:00,fr,ed6fdcb33c7c6d0f91fecda727b4afc0d08c7b88acae700d665d2c7b772a3fa7
