titre,texte,source_site,url,date_publication,langue,hash_fingerprint
Mardi Cuisine - 2025-10-28,"**Partagez vos recettes !**

La cuisine c'est tous les jours sur r/BonneBouffe

---

^(Ce sujet est généré automatiquement tous les mardis.) [^(Archives.)](http://www.reddit.com/r/france/search?q=mardi+cuisine+author%3AAutoModerator&sort=new&restrict_sr=on&t=all)",reddit.com,https://reddit.com/r/france/comments/1oi1ra3/mardi_cuisine_20251028/,2025-10-28 07:00:49,fr,2d7e95b1b02fd50dfc56c21e24ca1e9bc93458b6e37c098538c210e89de34c51
Forum Libre - 2025-10-28,"Partagez ici tout ce que vous voulez sauf la politique.  
Ce sujet est généré automatiquement vers 5 h - [Archives](https://www.reddit.com/r/france/search?q=Forum+Libre++author%3A%22automoderator%22&restrict_sr=on&sort=new&t=all).",reddit.com,https://reddit.com/r/france/comments/1ohzsk4/forum_libre_20251028/,2025-10-28 05:01:24,fr,1f1938719718bef0974925ad099c629cade53062c201c80c9c1fb128d76c0d22
Pourquoi tant de haine envers les personnes trans ?,"Petit rant, désolée...

Je suis juste un peu saoulée de voir que la haine des personnes trans est aussi répandue.

Quand j'ouvre les commentaires d'un article mainstream sur la transidentité, on se fait traiter de malades mentaux.

Sur Reddit, si le sub manque un peu de modération, on retrouve les pires horreurs.

Grokipedia est sorti aujourd'hui, je n'aurais sans doute pas dû avoir la curiosité morbide de regarder.

Et tout ça c'est sans compter sur les agressions qu'on se prend régulièrement dans la rue...

Et un des aspects durs, c'est que je ne comprends pas pourquoi on nous déteste autant.

Ok, je vois tout ce qu'on nous reproche, de corrompre la jeunesse, d'être des perverts, etc.

Mais je ne peux pas m'empêcher de me dire que tout ça devrait s'effondrer face aux faits, après avoir rencontré ne serait-ce qu'une personne transgenre.

Pourquoi est-ce qu'on nous laisse pas juste être nous ?",reddit.com,https://reddit.com/r/france/comments/1oib1bp/pourquoi_tant_de_haine_envers_les_personnes_trans/,2025-10-28 15:34:21,fr,fa5759fb4d9fb36bcad0cccd5f14f343813c751757978789cfe9e10aa2420d50
"Ici, on fait une tier-list maison des trucs dont on aimerait bien connaître le fin mot","Bonjour à tous, 

Je vous propose à tous de faire une tier-list du sub des mystères en cours dont on aimerait bien connaître le fin de mot de l'histoire avant de crever. 

Ce genre de trucs dont on a entendu parler aux infos, sur un subreddit obscur ou un podcast confidentiel, et dont on ne sait pas tout.

Vu avec la modération (qui m'a au passage suggéré le terme de ""mystier-list"", ils sont forts nos modos), le thread est en mode concours pour faire des votes plus équilibrés. Le principe est bien sûr de faire une seule suggestion de mystère par commentaire racine, afin de pouvoir voter avec les upvotes de reddit. Je ferai un prochain post pour valoriser les résultats. 

N'hésitez pas surtout à balancer une source pour les mystères les moins connus !",reddit.com,https://reddit.com/r/france/comments/1oi7q3t/ici_on_fait_une_tierlist_maison_des_trucs_dont_on/,2025-10-28 13:15:25,fr,96ae428cb147f570a1e4d5dc6ab16c56cf3b46bbff9cdbc6d8f7b1f0b0e3fc79
Appel 18 pour personne qui ne répond pas,"Bonjour, 
Mon père est très malade psychologiquement et ne répond plus au téléphone depuis 1 semaine. Nous sommes très inquiets, je suis assez loin en transport mais ça reste faisable (1h30 environ) mais je suis terrorisée d’y aller .. Nous avons déjà fait appel aux pompiers dans le passé (2 -3 fois ces 2 dernières années) et juste il s’était isolé il n’avait rien. Pensez vous que je peux faire appel à eux de nouveau ? Je ne veux pas les importuner de nouveau. J’ai peur qu’ils ne se déplacent plus a force.
Je ne connais ni voisin ni ami qui pourrait aller le voir sur place.
Merci pour votre aide ",reddit.com,https://reddit.com/r/france/comments/1oi3ree/appel_18_pour_personne_qui_ne_répond_pas/,2025-10-28 09:18:39,fr,29e7e30af9d7e03e568c0ac53582a00ab6cfe1f7f84f1103ef66bb938d09ee01
Question con mais… ça existe encore des flux RSS de presse contenant l’intégralité des articles ?,"Non parce que je crois que je suis arrivé au point où j’en ai ras la casquette d’avoir mes feeds remplis d’articles finissant par des phrases du style

> Cet article est réservé aux abonnés. Il vous reste 87% à découvrir.

Alors même que bien souvent je suis abonné.

Alors peut-être que je suis stupide et que je passe à côté des feeds spécial abonnés, mais je n’ai pas l’impression.

Du coup, ça existe encore (pour les abonnés évidemment, même si on n’est pas sectaires et qu’on prend tout…) et je suis idiot ou bien internet c’est définitivement devenu nul ?",reddit.com,https://reddit.com/r/france/comments/1ohysh3/question_con_mais_ça_existe_encore_des_flux_rss/,2025-10-28 04:08:39,fr,c43f4ecd117bcc54cb255af0e088359ca0aebb80a8db5813ef1cb3685b416c88
L'année sabbatique en France: une erreur ?,"Bonjour à tous,

J'écris ici parce que je suis un peu frustré et désespéré. L'année dernière, j'ai pris la décision de démissionner pour suivre mon rêve : traverser l'Europe à pieds. Je l'ai fait, et c'était un voyage très enrichissant. Mais voila, 7 mois que je suis de retour, que j'envoie CV sur CV pour trouver un boulot dans ma branche, dans des postes pour lesquelles je coche toutes les cases ou presque, et je n'ai aucun réponse.

Ce matin j'ai eu un appel avec un cabinet de recrutement, pour un job pour lequel j'avais 2 ans d'expérience qui correspondait exactement au poste, et dès que j'ai mentionné mon année sabbatique, mon interlocutrice a changé de ton et a commencé à dire que mon expérience n'était pas alignée avec ce que son client recherche. J'ai insisté en disant que si, c'était parfaitement pertinent, et elle a juste poliment dit qu'elle allait transmettre mon CV.

Je ne veux pas trop expliciter, car c'est un très petit milieu. J'ai une licence, deux masters, 2 ans et dem",reddit.com,https://reddit.com/r/france/comments/1oi7el3/lannée_sabbatique_en_france_une_erreur/,2025-10-28 13:00:13,fr,034a3bac3b46c96b91e85cf4b69402eaf744f7d1dbe75b1a5ea770b7a6e1bc39
À la recherche de marques de costumes des années 50s et 60s,"Bonjour, je suis présentement à la recherche d’un costume que portaient les francais des années 50s et 60s, plutôt comme Alain Delon. J’utilise ebay au quotidien pour mes recherches, mais je me demandais si il n’y avait pas quelqu’un qui saurait les marques qu’ils portaient à cette période pour les costumes? Merci!",reddit.com,https://reddit.com/r/france/comments/1oicsmc/à_la_recherche_de_marques_de_costumes_des_années/,2025-10-28 16:41:26,fr,7a87609807f8f9b177fe8aa53d43951246dea9479d9610127afd1296f1458cc6
S’installer à Briançon pour un jeune c’est bien ?,"Bonjour ! Je suis un jeune infirmier de 25 ans et je cherche à m’installer à Briançon. Je suis un grand fan de montagne en général que ce soit de la randonnée à l’alpinisme, mais je me demandais si il y avait des choses à savoir avant d’aller m’installer là-bas ? Des points négatifs comme positif, avoir l’avis des locaux ou même ceux qui y ont habité ! Je trouve pas grand chose sur internet, même niveau ce faire des relations ect. Merci !",reddit.com,https://reddit.com/r/france/comments/1oi5kel/sinstaller_à_briançon_pour_un_jeune_cest_bien/,2025-10-28 11:19:39,fr,b8816ae16afdbd8e84c802b6d7e2228b2ecfdb45f551b0859b1157732e4c0682
"FORUM LIBRE : TOURISTS AND RESIDENTS, ASK YOUR COMMON QUESTIONS IN THIS WEEKLY THREAD : Open Forum -- 26, October, 2025","# FR : Merci de lire avant de poster

Ce forum libre permet de discuter de tout et de rien et vous permet notamment de poser vos questions génériques par rapport à la ville et la région. Si vous venez d'arriver sur Paris et que vous voulez savoir où trouver des bars, manger un Pho ou trouver des clés à molette, ce forum est pour vous !

Pour toute question un peu plus corsée (et non touristique), n'hésitez pas à créer un sujet à part.

# __________________________________________

# EN : Please read before posting

If you have a simple question or tourism related one about the city, this megathread is for you!

Is the pricing of the métro confusing?

Do you want to know where you can find the shops that have that odd thing you're looking for?

The locals can help, ask away.

You should first take a look at [the wikivoyage page on Paris](https://en.wikivoyage.org/wiki/Paris) for general information. You should also download the app [Citymapper](https://citymapper.com/paris) to find your",reddit.com,https://reddit.com/r/paris/comments/1ogucvi/forum_libre_tourists_and_residents_ask_your/,2025-10-26 21:00:50,fr,fd9cacb59910dd5e883544193eff4f038ea8412072e33e9a1722370f808f1b4f
Est ce une presence de rat/ souris chez moi,"Hello,

Je suspecte la presence d’un rat/ souris chez moi mais j’ai du mal à la localiser, pouvez-vous m’aider à identifier ses croutes ou bien c’est autre chose ? 

Etant à paris je pense fortement à un rat/ souris.
",reddit.com,https://reddit.com/r/paris/comments/1oi8dh6/est_ce_une_presence_de_rat_souris_chez_moi/,2025-10-28 13:45:09,fr,20bd7d629423a3a8e281c5b9f7a18b991f93b73e6548d6618d1f17a465b04771
C’est quoi ce merdier sur la ligne 1? (Et peut-être sur tout le réseau?),"Alors la ligne 1 est ma ligne usuelle pour me rendre au boulot. J’aurais des lignes plus directes pour m’y rendre mais que je déteste (ligne 7 et 8, je vous vois). Je préfère donc pas mal marcher pour la rejoindre puis pas mal marcher pour aller jusqu’à mon taff.

Alors d’habitude et en heure de pointe, oui c’est dense mais les trains circulent et c’est correct.

Mais là, depuis trois semaines un mois, alors que c’est les vacances, alors qu’on n’est pas dans la période la plus touristique de l’année, même quand le RER A semble fonctionner relativement normalement, c’est un bordel sans nom matin et soir. Les trains sont là toutes les minutes trente mais c’est complètement bondé.

Vous avez remarqué la même chose? Y a quelque chose de particulier?",reddit.com,https://reddit.com/r/paris/comments/1oigidu/cest_quoi_ce_merdier_sur_la_ligne_1_et_peutêtre/,2025-10-28 18:58:11,fr,af923887ff72bc6684ed1423502a466546b214b35c0a3330a3bc28c4d763cd1f
Où manger végétarien à Paris sans ail ni oignon ?,"Salut à tous !

J’ai une amie végétarienne qui va venir me rendre visite à Paris bientôt, mais elle ne peut pas manger ni de l’ail, ni des oignons (donc les alliums).

Est-ce que quelqu’un connaît des restaurants végétariens (ou avec options végétariennes) où il est possible de manger sans ail ni oignon ?

Merci beaucoup d’avance pour vos recommandations 🙏

*(Je sais que c’est une demande un peu spécifique, donc même une seule adresse fiable serait super !)*

  
",reddit.com,https://reddit.com/r/paris/comments/1oi5huo/où_manger_végétarien_à_paris_sans_ail_ni_oignon/,2025-10-28 11:15:26,fr,9ea2cd9443450b9dc8f8ba2ccb90cd085322e70c935e4dcf44c70eef029440af
Sortie le 31,"Heyy ! 
Je me demandais s’il y avait des personnes sur Paris qui n’ont rien de prévu pour Halloween et qui aimeraient se faire une petite sortie ou une soirée sympa ! 
Je suis une fille de 20ans, actuellement en études sup et je suis arrivée à Paris en septembre dernier, donc encore en train de découvrir un peu la ville

Si vous êtes intéressé(e)s, n’hésitez pas à répondre à ce post et à m’envoyer un message privé avec votre Insta pour qu’on puisse s’organiser !",reddit.com,https://reddit.com/r/paris/comments/1oii8qp/sortie_le_31/,2025-10-28 20:03:11,fr,15a93963148a2e05f48e479a583ae670907a9bddf397879b45897995e41cdabb
Where to find a foster family in Paris,"Hello! I’m searching for a kind person in Paris who can foster my two indoor cats for about one month. They are friendly, clean, and used to apartment life. I will provide food, litter, and cover any expenses.
If you’re interested or know someone who could help, please send me a message.
Thank you so much!

",reddit.com,https://reddit.com/r/paris/comments/1oi7gar/where_to_find_a_foster_family_in_paris/,2025-10-28 13:02:12,fr,7e2c7c49094c5a1a2bb752d2a3caf99f214f289098c64ffc62a42b1c70a257f0
Moving to Paris from Berlin,"Hi all, 

My french spouse and I are considering moving to Paris from Berlin and wanted to ask if anyone else had experience doing it and if they regret it. (neither of us are German) 

Our main reasons for leaving: 

\- People in Berlin (I know people in Paris aren't much nicer, but we're getting tired of explaining jokes to people lol) but in all seriousness, we are looking for a slightly culturally warmer climate- we aren't expecting the south of france of course, but also tired of Berliners self- enforcing rules societal they make up. 

\- Lack of Diversity in Food in Berlin (can be considered diverse for Germany, not considered diverse in terms of global cities). 

\-Travel opportunities- pain to travel places from BER airport. 

\-We love going out but not big on Techno

  
Our main reasons for moving to Paris:

\-one of us is already French speaking

\-Closer to other major cities 

\-Great food (grocery quality as well) 

\-in our perspective, people are nicer 

  
We are by no",reddit.com,https://reddit.com/r/paris/comments/1oiid2c/moving_to_paris_from_berlin/,2025-10-28 20:07:49,fr,b4f5ef1a0f5dc9cde2c20526bd5b92cf0b7330a7e2247f1a941102de8e5ed0b7
Partenaires de tennis?,"Bonjour tout le monde,

H27, je recherche des partenaires de tennis pour jouer sur Paris Est / Vincennes mais ouvert a me déplacer un peu plus loin J’ai joué 6 ans plus jeune, et repris depuis peu, niveau plutôt intermédiaire 30

Au plaisir!",reddit.com,https://reddit.com/r/paris/comments/1oib6wy/partenaires_de_tennis/,2025-10-28 15:40:28,fr,d4c976e6fa888ab3bcc08f2f05bc63eaaf3d68a219fdd1cb173bd595dac0d375
Départ anticipé de location contre indemnité : que puis-je réellement demander ?,"Bonjour à toustes, 

mon immeuble vient d'être racheté et les nouveaux propriétaires ont mandaté une société pour inciter les locataires à évacuer leur logement le plus rapidement possible, contre une indemnité, variable selon la situation : ils doivent effectuer des travaux de rénovation afin de relever le DPE, c'est une opération immobilière qu'ils ont tout intérêt à entamer au plus vite, afin de relouer (beaucoup plus cher). 

Je suis dans le 19ème, j'ai emménagé fin décembre 2021 et mon bail de 3 ans a été reconduit en décembre 2024. Mon loyer est de 1050€ pour 38m2, inutile de dire que je ne retrouverai pas de location de même standard en déménageant. J'adore mon appart et cela me déchire le coeur de partir, cependant je n'ai pas vraiment de choix, le mandataire m'a bien expliqué que j'avais tout intérêt à coopérer, et le plus vite possible pour avoir les meilleures conditions.

Ils sont prêts à offrir 10 000€ / 13 000€ d'indemnités (le montant a l'air d'avoir été calculé selon le",reddit.com,https://reddit.com/r/paris/comments/1ohvttc/départ_anticipé_de_location_contre_indemnité_que/,2025-10-28 01:47:28,fr,a19eff857ae8e9bfa7e327a480de69af23f17d9344dfc8fc4b01de1b564f0b9c
Looking for functional doctor in Paris,"Hello all,

maybe someone can help me: I am looking for a functional doctor in Paris. 

I want to get a more extensive blood test / hormone testing as I have hormonal acne in my 20s. I have had it for 10 years and nothing I have tried has helped. 

Preferably English speaking, but French works as well. 

Thank you. ",reddit.com,https://reddit.com/r/paris/comments/1oib6rz/looking_for_functional_doctor_in_paris/,2025-10-28 15:40:19,fr,41588fb94e18dd33cda0f27baeda20a38fd3e86c9314ef7107c16c15f188db0d
Où trouver du bon son house/techno entre 19h et 00h ?,"Hello les gens,

  
J'étais un peu coutumier des clubs (rex / concrète / la machine / nuits fauves, etc. ) et ça fait un moment que je n'y suis pas allé. En ce moment je retombe dans mes amours musicaux house / techno MAIS je n'ai pas envie d'attendre 01h du matin pour démarrer ma soirée (franchement 01h du mat je suis trop rincé, je dors).

 La question est donc dans le titre.

Merci biiiiieenn",reddit.com,https://reddit.com/r/paris/comments/1ohbbhp/où_trouver_du_bon_son_housetechno_entre_19h_et_00h/,2025-10-27 11:58:37,fr,fe78387fd75615a5b98f7b5151d985a6e38841a54bbeefe72b2231349be94836
Need help with Birthday,My friend birthday coming up on 24 November I need to give him a present but currently I'm living in India can someone help me with it? Who can deliver to him?,reddit.com,https://reddit.com/r/paris/comments/1oi3nno/need_help_with_birthday/,2025-10-28 09:11:28,fr,24ee98cdd29d451601e4bc7e01907b0f50ea8ab03ec7a8a6e755e1cfe092d983
Demenager à Paris pour le travail ou rester dans le sud?,Je suis dans un dilemme. J’ai 25 et j’habite dans le sud et j’ai eu mon premier CDI sur Paris (dans le 92) pour un salaire de 31k brut. J’ai trouvé une sous-location dans le 13ème et ça me fera 40min de trajet je pense en metro. Mais on vient de m’annoncer que je peux faire du distanciel exclusivement. Est-ce que ça vaut le coup de demenager à Paris et changer un peu d’environnement ou je reste dans le sud? ,reddit.com,https://reddit.com/r/paris/comments/1ohl9vq/demenager_à_paris_pour_le_travail_ou_rester_dans/,2025-10-27 18:48:36,fr,839713e12ddaa3a650d93ac95a958b06d5bc785c6f3ccc83f899e8c40ed38da9
Restaurant recommendations for team’s private dining,"My team (15-20ppl) will be in Paris next week for a conference and I am looking to book them a nice dinner for the evening. Ideally in a restaurant with private dining room or a small cozy, homey restaurant where we can rent the whole place for the evening. Does anyone here have any recommendation for that? I am unfamiliar with Paris unfo. It doesnt matter what kind of cuisine too as long as it’s good :) Thanks a lot! ",reddit.com,https://reddit.com/r/paris/comments/1oi1db4/restaurant_recommendations_for_teams_private/,2025-10-28 06:35:45,fr,56db3eba561d868094b67f84cc2edca341b665a406a7d9e6fd39643baff17605
Lost AirPods,"So recently just came back to Ireland from a trip to Disneyland and it seems at some point on the last day my AirPods have been misplaced/stolen at some point either in the hotel or a taxi.

I’ve already accepted that they’re lost but thought hey worth a shot posting here if anyone is beside it :)

They seem to have somehow ended up in a town called Meaux on the north east area

Merci!



",reddit.com,https://reddit.com/r/paris/comments/1oi5bhu/lost_airpods/,2025-10-28 11:04:46,fr,97480688133b6495b4fcbf26a89a5dd8345c1f78bbe3d49c0c620cacbd59eef3
Conseils pour chercher un logement près de Les Ulis,"Bonjour à tous,

Je déménage en France à la fin de l’année pour faire un stage de 6 mois à Les Ulis. J’aimerais avoir vos conseils sur les villes ou quartiers où chercher un logement.

Idéalement, je cherche un endroit relativement sûr, abordable pour les étudiants, et pas trop loin d’une station de RER vers Les Ulis.

Merci beaucoup !",reddit.com,https://reddit.com/r/paris/comments/1ohwv5c/conseils_pour_chercher_un_logement_près_de_les/,2025-10-28 02:35:31,fr,718a6b268b44fdb92bd8e8acb0ca7ff23b5a91138140ee2fbf7eb218264ccee1
Où acheter des produits direct producteur,"Bonjour à tous, rat écolo que je suis, j'aimerais faire une liste des producteurs en IDF qui vendent en direct leurs fruits, légumes, fromages, viande etc. Idéalement (mais pas forcément) bio. S'ils proposent une livraison sur Paris ou une vente en ligne, encore mieux...

Je commence : La cueillette de Compans. Pas de vente en ligne, il faut y aller et cueillir soi même ce qu'on veut. Ils indiquent chaque semaine sur leur compte instagram quels produits sont en saison. C'est du travail mais globalement ça vaut le coup (qualité + aspect financier), surtout pour les produits qui se gardent longtemps (patates/carottes/oignons...). Il faut une voiture.",reddit.com,https://reddit.com/r/paris/comments/1ohg9zw/où_acheter_des_produits_direct_producteur/,2025-10-27 15:43:32,fr,d7e9d6aaa376c0a2b57fb1eab46cc5ed481b00e9d576f41dd8773a963cf62d7e
Bar sympa à privatiser pour soirée avec dj?,Je me rends compte que c’est pas évident de trouver quelque chose sans débourser >3000€ pour 40-50 personnes donc je tente ma chance ici…  ,reddit.com,https://reddit.com/r/paris/comments/1ohtspn/bar_sympa_à_privatiser_pour_soirée_avec_dj/,2025-10-28 00:17:21,fr,c03d1f37c693b3e9150a1a705f7b085bbdaafb0abcc4a8703e44a0b7f86ac0c8
record shop / vinyls,"bonjour. je suis de bref passage demain et je voulais savoir quelles étaient les meilleurs adresses pour des record stores spécialisés sur le folk, neo folk, harsh noise, hc punk et metal ? ",reddit.com,https://reddit.com/r/paris/comments/1ohjhpw/record_shop_vinyls/,2025-10-27 17:43:04,fr,e1c769b74bab1d8485c54057057c63be538c18ecf64f24ce11d4933e1a0b04d9
Speos school,"Anyone studying or has already studied at the Speos photo school? 
How was your experience? I'm looking for direct testimony.",reddit.com,https://reddit.com/r/paris/comments/1ohpw1n/speos_school/,2025-10-27 21:40:26,fr,bbfa5c10be051b024c287ef52c3c4151dcc5d500f0336b1804bd15e04afd2fac
Bar calme et tamisé vers auber ?,"Hello !

Pour un 2eme date, sauriez vous me conseiller un bar pas trop bruyant, avec un minimum d'espace entre les tables et une atmosphère chaleureuse, dans les environs de Auber ?

Je vois remercie !",reddit.com,https://reddit.com/r/paris/comments/1ohbwy6/bar_calme_et_tamisé_vers_auber/,2025-10-27 12:31:15,fr,0743b586e95a4e5c29e31e2d1081fd4240f21c838b0096a4140d798e00935864
Appartement dernier étage,"Bonsoir.

J'ai été proposé un appartement au dernier étage d'un immeuble daté de 1900. Je suis un peu susceptible au bruit et je me demandais donc si les appartements au dernier étage des bâtiments parisiens son particulièrement bruyants.

Si vous avez des avis d'autres inconvénients je suis preneur.

Merci",reddit.com,https://reddit.com/r/paris/comments/1ohmeqo/appartement_dernier_étage/,2025-10-27 19:30:24,fr,547c3c0a578c77dbdba7571a60fabc0123fcc34d13e4b2f6b5ad982be35339ef
Permis via compte CPF Paris,"Bonjour à tous,

Après 29 ans dans notre beau pays, je suis obligé de passer le permis pour passer un step dans ma vie professionnelle. Par curiosité, je suis allé voir sur mon compte CPF à combien j'avais de droit et plutôt bonne surprise j'ai 1300 euros dessus. Je me retrouve donc devant l'embarra du choix avec des offres qui ont l'air bien trop peu cher pour être bien et des trucs a 4000 euros. Triste partie de l'histoire pour moi j'habite à Paris, donc je me tape j'imagine l'inflation royale.

Je suis près a aller jusqu'à 2000 euros, ca me coutera a moi que 700 donc bon deal (en tout cas j'ai l'impression) mais il y a t'il des parisiens ici qui pourraient me donner des conseils et retour sur les choix qu'ils ont fait ? Si par exemple vous avez un bon plan pour moi je suis preneur",reddit.com,https://reddit.com/r/paris/comments/1ohlu72/permis_via_compte_cpf_paris/,2025-10-27 19:08:54,fr,465629763d432c978ebcb550364086a3bafda09b299957a1739bf6411d2ed51d
pylone métallique en plein Paris,"Bonjour, quelle est cette structure, son utilité et où se trouve-telle ? (Photo prise depuis le toit d'un immeuble près du Grand Palais vers le Sacré Coeur)Merci. Bonne journée. Michel

https://preview.redd.it/s5t2xhttomxf1.jpg?width=1339&format=pjpg&auto=webp&s=8e20e49b0d10b7afc5f75fa3b8fd32d501d6f368

",reddit.com,https://reddit.com/r/paris/comments/1ohafq8/pylone_métallique_en_plein_paris/,2025-10-27 11:05:25,fr,af51af55394609dabde2e921b0d10bdc26c5562d8f900823c75882c01d684ae2
Is it hard to find now a job that won't start until January?,"I'm an international student here in Paris, and after December I'll be done with university but also financially on my own, which means that in order to stay here I'll need to find a job that will cover all my expenses. The thing is, even though I won't be able to start working until January, I need to find a job now (basically in the next two weeks), because if I don't find anything, I'll have to end my lease and leave my apartment in December. For several reasons (including the fact that I do understand French pretty well but my spoken level is not professional/academic at all) I'm not looking for any high-skilled professions related to my university degree, just something like a bar or a café that will allow me to stay here for a few months while I figure out what to do with my degree. 

Since I've never worked here in Paris (or even in France), I'm a little scared because I don't know how easy it would be to find an employer now who's going to be okay with the fact that I won't be ",reddit.com,https://reddit.com/r/paris/comments/1ohefxc/is_it_hard_to_find_now_a_job_that_wont_start/,2025-10-27 14:29:46,fr,73e1ad08ad7ad62ee15fd17a4aa62a622f013bb6ba5dea61234319e656652c61
Quelqu'un sait-il où acheter des cynorrhodons / fruits d'églantier frais à Paris ?,"Salut à tous !

Je voudrais faire de la confiture de cynorrhodon pour ma belle-sœur pour Noël, et pour ça j'aimerais trouver un endroit où acheter des cynorrhodons frais à Paris (et bio si vous avez en plus héhé), mais je n'en trouve que des secs pour les tisanes...

Merci d'avance si vous avez des suggestions !",reddit.com,https://reddit.com/r/paris/comments/1ohk6w6/quelquun_saitil_où_acheter_des_cynorrhodons/,2025-10-27 18:08:51,fr,446f3626f40473e5f4da5566a39e3c31f446d1cfbfee2929029cf691c8b8be09
